[
  {
    "id": "sep-mysticism",
    "title": "Mysticism",
    "author": "Stanford Encyclopedia of Philosophy",
    "url": "https://plato.stanford.edu/entries/mysticism/",
    "kind": "scholarly_reference",
    "accessed": "2026-09-19",
    "review_status": "selected_relevant_passages_reviewed",
    "supports": "Mysticism, experience, interpretation, ineffability and noetic claims.",
    "limitations": "Selected sections reviewed; definitions vary across traditions.",
    "independent_work_id": "sep-mysticism"
  },
  {
    "id": "sep-dionysius",
    "title": "Pseudo-Dionysius the Areopagite",
    "author": "Stanford Encyclopedia of Philosophy",
    "url": "https://plato.stanford.edu/entries/pseudo-dionysius-areopagite/",
    "kind": "scholarly_reference",
    "accessed": "2026-09-19",
    "review_status": "selected_relevant_passages_reviewed",
    "supports": "Apophatic and kataphatic theology; divine names and limits of language.",
    "limitations": "Christian theological context; not a generic occult dictionary.",
    "independent_work_id": "sep-dionysius"
  },
  {
    "id": "sep-ibn-arabi",
    "title": "Ibn Arabi",
    "author": "Stanford Encyclopedia of Philosophy",
    "url": "https://plato.stanford.edu/entries/ibn-arabi/",
    "kind": "scholarly_reference",
    "accessed": "2026-09-19",
    "review_status": "selected_relevant_passages_reviewed",
    "supports": "Imaginal reality, imagination and barzakh in Ibn Arabi.",
    "limitations": "Selected philosophical sections reviewed; does not represent every Sufi school.",
    "independent_work_id": "sep-ibn-arabi"
  },
  {
    "id": "sep-plotinus",
    "title": "Plotinus",
    "author": "Stanford Encyclopedia of Philosophy",
    "url": "https://plato.stanford.edu/entries/plotinus/",
    "kind": "scholarly_reference",
    "accessed": "2026-09-19",
    "review_status": "selected_relevant_passages_reviewed",
    "supports": "The One, Intellect and metaphysical procession.",
    "limitations": "Selected sections reviewed; philosophical claims described, not endorsed as measurements.",
    "independent_work_id": "sep-plotinus"
  },
  {
    "id": "sep-proclus",
    "title": "Proclus",
    "author": "Stanford Encyclopedia of Philosophy",
    "url": "https://plato.stanford.edu/entries/proclus/",
    "kind": "scholarly_reference",
    "accessed": "2026-09-19",
    "review_status": "selected_relevant_passages_reviewed",
    "supports": "Theurgy and late Platonist approaches to divine assimilation.",
    "limitations": "Section 3.6 reviewed.",
    "independent_work_id": "sep-proclus"
  },
  {
    "id": "sep-ficino",
    "title": "Marsilio Ficino",
    "author": "Stanford Encyclopedia of Philosophy",
    "url": "https://plato.stanford.edu/entries/ficino/",
    "kind": "scholarly_reference",
    "accessed": "2026-09-19",
    "review_status": "selected_relevant_passages_reviewed",
    "supports": "Renaissance Platonism and reception of ancient theology.",
    "limitations": "Overview reviewed; no claims of uninterrupted ancient lineage.",
    "independent_work_id": "sep-ficino"
  },
  {
    "id": "iep-gnostic",
    "title": "Gnosticism",
    "author": "Internet Encyclopedia of Philosophy",
    "url": "https://iep.utm.edu/gnostic/",
    "kind": "scholarly_reference",
    "accessed": "2026-09-19",
    "review_status": "selected_relevant_passages_reviewed",
    "supports": "Gnosis, aeons, Sophia, pleroma and demiurge in selected systems.",
    "limitations": "An interpretive overview of diverse movements, not a uniform creed.",
    "independent_work_id": "iep-gnostic"
  },
  {
    "id": "unesco-burkhan",
    "title": "Great Burkhan Khaldun Mountain and its surrounding sacred landscape",
    "author": "UNESCO World Heritage Centre",
    "url": "https://whc.unesco.org/en/list/1440/",
    "kind": "institutional_heritage",
    "accessed": "2026-09-19",
    "review_status": "selected_relevant_passages_reviewed",
    "supports": "Sacred landscape, worship traditions, ovoo and documented restrictions.",
    "limitations": "Nomination-era heritage description; not a current visitor-permission or legal guide.",
    "independent_work_id": "unesco-burkhan"
  },
  {
    "id": "ashmolean-spellbound",
    "title": "Spellbound: Magic, Ritual & Witchcraft",
    "author": "Ashmolean Museum, University of Oxford",
    "url": "https://www.ashmolean.org/spellbound",
    "kind": "museum_reference",
    "accessed": "2026-09-19",
    "review_status": "selected_relevant_passages_reviewed",
    "supports": "Material objects and historical European magical beliefs.",
    "limitations": "Exhibition ran in 2018–2019; supports object history, not supernatural efficacy.",
    "independent_work_id": "ashmolean-spellbound"
  },
  {
    "id": "cornell-witchcraft",
    "title": "The World Bewitch'd: Introduction",
    "author": "Cornell University Library",
    "url": "https://rmc.library.cornell.edu/witchcraft/exhibition/introduction/index.html",
    "kind": "curated_archive",
    "accessed": "2026-09-19",
    "review_status": "selected_relevant_passages_reviewed",
    "supports": "Witchcraft accusations, persecution and historical evidence.",
    "limitations": "Accusations are not proof that the accused practiced magic.",
    "independent_work_id": "cornell-witchcraft"
  },
  {
    "id": "agrippa-1",
    "title": "Three Books of Occult Philosophy, Book I, part 1",
    "author": "Heinrich Cornelius Agrippa; English translation 1651; digital edition Joseph H. Peterson",
    "url": "https://www.esotericarchives.com/agrippa/agrippa1.htm",
    "kind": "historical_primary",
    "accessed": "2026-09-19",
    "review_status": "selected_relevant_passages_reviewed",
    "supports": "Natural magic, elements and hidden properties in Renaissance cosmology.",
    "limitations": "Historical text; modern editorial notes and transcriptions have separate rights.",
    "independent_work_id": "agrippa-occult-philosophy"
  },
  {
    "id": "agrippa-2",
    "title": "Three Books of Occult Philosophy, Book II, part 1",
    "author": "Heinrich Cornelius Agrippa; English translation 1651; digital edition Joseph H. Peterson",
    "url": "https://www.esotericarchives.com/agrippa/agrippa2.htm",
    "kind": "historical_primary",
    "accessed": "2026-09-19",
    "review_status": "selected_relevant_passages_reviewed",
    "supports": "Number symbolism and mathematical magic.",
    "limitations": "A historical belief system; numerology is not statistical inference.",
    "independent_work_id": "agrippa-occult-philosophy"
  },
  {
    "id": "agrippa-2b",
    "title": "Three Books of Occult Philosophy, Book II, part 2",
    "author": "Heinrich Cornelius Agrippa; English translation 1651; digital edition Joseph H. Peterson",
    "url": "https://www.esotericarchives.com/agrippa/agripp2b.htm",
    "kind": "historical_primary",
    "accessed": "2026-09-19",
    "review_status": "selected_relevant_passages_reviewed",
    "supports": "Numerical correspondences, letters and celestial symbolism.",
    "limitations": "Selected passages reviewed; do not treat correspondences as universal.",
    "independent_work_id": "agrippa-occult-philosophy"
  },
  {
    "id": "agrippa-3",
    "title": "Three Books of Occult Philosophy, Book III, part 1",
    "author": "Heinrich Cornelius Agrippa; English translation 1651; digital edition Joseph H. Peterson",
    "url": "https://www.esotericarchives.com/agrippa/agrippa3.htm",
    "kind": "historical_primary",
    "accessed": "2026-09-19",
    "review_status": "selected_relevant_passages_reviewed",
    "supports": "Religious magic, secrecy and restrictions on disclosure.",
    "limitations": "Chapter II especially; author's reports about other cultures require independent verification.",
    "independent_work_id": "agrippa-occult-philosophy"
  },
  {
    "id": "goetia",
    "title": "Lemegeton, Part 1: Goetia",
    "author": "Historical manuscripts; digital edition Joseph H. Peterson",
    "url": "https://www.esotericarchives.com/solomon/goetia.htm",
    "kind": "historical_primary",
    "accessed": "2026-09-19",
    "review_status": "selected_relevant_passages_reviewed",
    "supports": "Spirit catalogues, seals, circles, conjuration and dismissal.",
    "limitations": "Literary and historical reference; no claim that spirits or coercive rites work.",
    "independent_work_id": "goetia"
  },
  {
    "id": "emerald",
    "title": "Emerald Tablet of Hermes: Translations",
    "author": "Historical translations collected by Internet Sacred Text Archive",
    "url": "https://sacred-texts.com/alc/emerald.htm",
    "kind": "primary_text_collection",
    "accessed": "2026-09-19",
    "review_status": "selected_relevant_passages_reviewed",
    "supports": "Upper/lower correspondence and alchemical imagery.",
    "limitations": "Composite page includes modern translations and commentary; no bulk text copied.",
    "independent_work_id": "emerald"
  },
  {
    "id": "hydrolith",
    "title": "The Sophic Hydrolith, in The Hermetic Museum, Volume I",
    "author": "Historical alchemical tract; A. E. Waite English edition, 1893",
    "url": "https://sacred-texts.com/book/the-hermetic-museum-volume-i/shell/the-sophic-hydrolith",
    "kind": "historical_primary",
    "accessed": "2026-09-19",
    "review_status": "selected_relevant_passages_reviewed",
    "supports": "Black, white and red stages; dissolution, condensation and allegory.",
    "limitations": "Historical chemical and religious claims are not instructions or verified remedies.",
    "independent_work_id": "hydrolith"
  },
  {
    "id": "golden-tract",
    "title": "The Golden Tract Concerning the Stone of the Philosophers",
    "author": "Historical alchemical tract; A. E. Waite English edition, 1893",
    "url": "https://sacred-texts.com/book/the-hermetic-museum-volume-i/shell/the-golden-tract-concerning-the-stone-of-the-philosophers",
    "kind": "historical_primary",
    "accessed": "2026-09-19",
    "review_status": "selected_relevant_passages_reviewed",